{
  "format": "mz.readme-brief/2",
  "scope": "readme",
  "repository": "MuziGeek/mz-beautify-readme",
  "audience": "Codex users and README maintainers who want project-native design with an optional Muzi visual layer",
  "oneSentenceValue": "Preserve upstream README design decisions, then add Muzi only when repository routing permits.",
  "primaryProof": "The localized MZ Icon Design and MZ Visual Engine README hero sets generated through two different upstream routes",
  "firstSuccessfulAction": "Install the nested Skill from GitHub and invoke $mz-beautify-readme in a repository.",
  "coreDecision": {
    "upstreamCommit": "55bdb1c05414cd7a0cf911d02e55ece79777206e",
    "compositionMode": "split",
    "implementation": "hybrid",
    "motion": "none",
    "motionAuthorized": false,
    "themeSpec": {
      "palette": "Warm paper, dark ink, navy structure, mustard emphasis, and restrained rust markers",
      "typography": "Expressive project title paired with compact technical system labels",
      "shape": "One divided working field with a single continuous character-and-routing scene",
      "motif": "A fixed design core connected to an optional visual overlay and localized outputs",
      "composition": "Split title and system scene, followed immediately by two full-width real examples"
    }
  },
  "overlay": {
    "id": "muzi",
    "activationReason": "ownership-default",
    "characterMode": "muzi",
    "companionMode": "include",
    "displayFont": "pfanhututi"
  },
  "localization": {
    "primaryLocale": "en",
    "outputLocales": ["en", "zh-CN"],
    "assetStrategy": "localized-assets",
    "readmeFiles": {"en": "README.md", "zh-CN": "README.zh-CN.md"}
  },
  "proofSources": [
    "docs/readme/samples/mz-icon-design/hero.webp",
    "docs/readme/samples/mz-visual-engine/hero.svg"
  ],
  "heroCopy": {
    "title": "MZ Beautify README",
    "value": "Project-native README design. Muzi only when routing permits.",
    "context": "PINNED CORE → OPTIONAL OVERLAY",
    "processCue": "CORE DECISION · VISUAL OVERLAY · LOCALIZED ASSETS",
    "proofLabels": ["CORE", "OVERLAY", "EN · 中文"]
  },
  "localizedHeroCopy": {
    "zh-CN": {
      "title": "MZ Beautify README",
      "value": "先做项目原生设计，再按路由叠加木子视觉",
      "context": "固定上游核心 → 可选木子视觉层",
      "processCue": "核心决策 · 视觉覆盖 · 多语言资产",
      "proofLabels": ["核心", "视觉层", "EN · 中文"]
    }
  },
  "lockedCopy": [
    "MZ Beautify README",
    "Project-native README design. Muzi only when routing permits.",
    "PINNED CORE → OPTIONAL OVERLAY",
    "CORE DECISION · VISUAL OVERLAY · LOCALIZED ASSETS",
    "CORE", "OVERLAY", "EN · 中文",
    "先做项目原生设计，再按路由叠加木子视觉",
    "固定上游核心 → 可选木子视觉层",
    "核心决策 · 视觉覆盖 · 多语言资产",
    "核心", "视觉层"
  ],
  "status": "READY_FOR_REVIEW"
}
